{
  "id": "ch_letter_01",
  "language": "hindi",
  "char": "рдЪ",
  "audio": "audio/letters/ch/рдЪ.mp3",
  "stroke_anim": "animations/letters/ch/рдЪ.json",
  "examples": [
    {"word": "рдЪрдореНрдордЪ", "emoji": "ЁЯеД", "audio": "audio/words/chammach.mp3", "meaning": "Spoon", "sentence": "рд╕реВрдк рдХреЗ рд▓рд┐рдП рдЪрдореНрдордЪ рдЪрд╛рд╣рд┐рдПред"},
    {"word": "рдЪрд╛рдХреВ", "emoji": "ЁЯФк", "audio": "audio/words/chaku.mp3", "meaning": "Knife", "sentence": "рд╕рдмреНрдЬреА рдХрд╛рдЯрдиреЗ рдХреЗ рд▓рд┐рдП рдЪрд╛рдХреВ рд▓реЗрдВред"},
    {"word": "рдЪрд░рдЦрд╛", "emoji": "ЁЯз╡", "audio": "audio/words/charkha.mp3", "meaning": "Spinning wheel", "sentence": "рдкреБрд░рд╛рдиреЗ рд╕рдордп рдореЗрдВ рдЪрд░рдЦрд╛ рдЪрд▓рддрд╛ рдерд╛ред"}
  ]
}
