{
  "id": "ii_letter_01",
  "language": "hindi",
  "char": "рдИ",
  "audio": "audio/letters/ii/рдИ.mp3",
  "stroke_anim": "animations/letters/ii/рдИ.json",
  "examples": [
    {"word": "рдИрдЦ", "emoji": "ЁЯМ╛", "audio": "audio/words/eekh.mp3", "meaning": "Sugarcane", "sentence": "рдЧрд░реНрдореА рдореЗрдВ рд▓реЛрдЧ рдИрдЦ рдХрд╛рдЯрддреЗ рд╣реИрдВред"},
    {"word": "рдИрдж", "emoji": "ЁЯОЙ", "audio": "audio/words/eid.mp3", "meaning": "Eid (festival)", "sentence": "рдИрдж рдкрд░ рдорд┐рдард╛рдИ рдмрд╛рдВрдЯреА рдЬрд╛рддреА рд╣реИред"},
    {"word": "рдИрдорд╛рди", "emoji": "ЁЯдЭ", "audio": "audio/words/imaan.mp3", "meaning": "Honesty", "sentence": "рдИрдорд╛рди рд╕рдмрд╕реЗ рдмрдбрд╝рд╛ рдЧреБрдг рд╣реИред"}
  ]
}
