{
  "id": "u_letter_01",
  "language": "hindi",
  "char": "рдЙ",
  "audio": "audio/letters/u/рдЙ.mp3",
  "stroke_anim": "animations/letters/u/рдЙ.json",
  "examples": [
    {"word": "рдЙрд▓реНрд▓реВ", "emoji": "ЁЯжЙ", "audio": "audio/words/ullu.mp3", "meaning": "Owl", "sentence": "рд░рд╛рдд рдореЗрдВ рдЙрд▓реНрд▓реВ рдЖрд╡рд╛рдЬ рдХрд░рддрд╛ рд╣реИред"},
    {"word": "рдЙрджреНрдпрд╛рди", "emoji": "ЁЯПЮя╕П", "audio": "audio/words/udyan.mp3", "meaning": "Garden", "sentence": "рд╣рдо рдкрд╛рд░реНрдХ рдореЗрдВ рдЙрджреНрдпрд╛рди рдореЗрдВ рдЧрдПред"},
    {"word": "рдЙрд▓реНрдЯрд╛", "emoji": "ЁЯФБ", "audio": "audio/words/ulta.mp3", "meaning": "Opposite", "sentence": "рдХрд╛рдЧрдЬрд╝ рдХреЛ рдЙрд▓реНрдЯрд╛ рдореЛрдбрд╝реЛред"}
  ]
}
