{
  "id": "tth_letter_01",
  "language": "hindi",
  "char": "рда",
  "audio": "audio/letters/tth/рда.mp3",
  "stroke_anim": "animations/letters/tth/рда.json",
  "examples": [
    {"word": "рдардВрдб", "emoji": "тЭДя╕П", "audio": "audio/words/thand.mp3", "meaning": "Cold", "sentence": "рд╕рд░реНрджрд┐рдпреЛрдВ рдореЗрдВ рдмрд╣реБрдд рдардВрдб рд╣реЛрддреА рд╣реИред"},
    {"word": "рдареЗрд▓рд╛", "emoji": "ЁЯЫТ", "audio": "audio/words/thela.mp3", "meaning": "Cart", "sentence": "рдмрд╛рдЬрд╛рд░ рдореЗрдВ рдареЗрд▓рд╛ рд▓рдЧрд╛ рд╣реИред"},
    {"word": "рдард╣рд░рдирд╛", "emoji": "тП╕я╕П", "audio": "audio/words/thaharna.mp3", "meaning": "Stay/Stop", "sentence": "рдХреГрдкрдпрд╛ рдард╣рд░рд┐рдпреЗред"}
  ]
}
