{
  "id": "nya_letter_01",
  "language": "hindi",
  "char": "рдЮ",
  "audio": "audio/letters/nya/рдЮ.mp3",
  "stroke_anim": "animations/letters/nya/рдЮ.json",
  "examples": [
    {"word": "рдЬреНрдЮрд╛рдирд╛", "emoji": "ЁЯУШ", "audio": "audio/words/jyana.mp3", "meaning": "Knowledge (archaic)", "sentence": "рдЬреНрдЮрд╛рди рдорд╣рддреНрд╡рдкреВрд░реНрдг рд╣реИред"},
    {"word": "рдЕрдиреНрдп", "emoji": "ЁЯФД", "audio": "audio/words/anya.mp3", "meaning": "Other", "sentence": "рдпрд╣ рд╡рд┐рдХрд▓реНрдк рдЕрдиреНрдп рд╣реИред"},
    {"word": "рдЬреНрдЮрд╛рди", "emoji": "ЁЯТб", "audio": "audio/words/gyaan.mp3", "meaning": "Knowledge", "sentence": "рдкрдврд╝рд╛рдИ рд╕реЗ рдЬреНрдЮрд╛рди рдорд┐рд▓рддрд╛ рд╣реИред"}
  ]
}
