{
  "id": "nga_letter_01",
  "language": "hindi",
  "char": "рдЩ",
  "audio": "audio/letters/nga/рдЩ.mp3",
  "stroke_anim": "animations/letters/nga/рдЩ.json",
  "examples": [
    {"word": "рдЩрд╛рд▓", "emoji": "ЁЯФЦ", "audio": "audio/words/ngal.mp3", "meaning": "(example placeholder)", "sentence": "рдпрд╣ рд╢рдмреНрдж рджреБрд░реНрд▓рдн рд╣реИред"},
    {"word": "рдЩреЛрдк", "emoji": "ЁЯФд", "audio": "audio/words/ngop.mp3", "meaning": "(placeholder)", "sentence": "рдпрд╣ рдПрдХ рдирдореВрдирд╛ рд╡рд╛рдХреНрдп рд╣реИред"},
    {"word": "рдЩреБ", "emoji": "ЁЯУО", "audio": "audio/words/ngu.mp3", "meaning": "(placeholder)", "sentence": "рдЗрд╕ рдлрд╝рд╛рдЗрд▓ рдХрд╛ рдЙрджреНрджреЗрд╢реНрдп рдЙрджрд╛рд╣рд░рдг рджрд┐рдЦрд╛рдирд╛ рд╣реИред"}
  ]
}
