{
  "id": "j_letter_01",
  "language": "hindi",
  "char": "рдЬ",
  "audio": "audio/letters/j/рдЬ.mp3",
  "stroke_anim": "animations/letters/j/рдЬ.json",
  "examples": [
    {"word": "рдЬрд▓реЗрдмреА", "emoji": "ЁЯзБ", "audio": "audio/words/jalebi.mp3", "meaning": "Jalebi (sweet)", "sentence": "рддреНрдпреЛрд╣рд╛рд░ рдкрд░ рдЬрд▓реЗрдмреА рдмрдиреАред"},
    {"word": "рдЬрдЧ", "emoji": "ЁЯлЧ", "audio": "audio/words/jag.mp3", "meaning": "Jug", "sentence": "рдкрд╛рдиреА рдХреЗ рд▓рд┐рдП рдЬрдЧ рднрд░реЛред"},
    {"word": "рдЬрд╣рд╛рдЬрд╝", "emoji": "тЬИя╕П", "audio": "audio/words/jahaz.mp3", "meaning": "Plane/Ship", "sentence": "рд╣рдордиреЗ рдЬрд╣рд╛рдЬрд╝ рджреЗрдЦрд╛ред"}
  ]
}
