{
  "id": "t_letter_01",
  "language": "hindi",
  "char": "рдЯ",
  "audio": "audio/letters/t/рдЯ.mp3",
  "stroke_anim": "animations/letters/t/рдЯ.json",
  "examples": [
    {"word": "рдЯрдорд╛рдЯрд░", "emoji": "ЁЯНЕ", "audio": "audio/words/tamatar.mp3", "meaning": "Tomato", "sentence": "рдЯрдорд╛рдЯрд░ рд▓рд╛рд▓ рд╣реЛрддрд╛ рд╣реИред"},
    {"word": "рдЯрд┐рдХрд┐рдЯ", "emoji": "ЁЯОл", "audio": "audio/words/ticket.mp3", "meaning": "Ticket", "sentence": "рдореБрдЭреЗ рдЯрд┐рдХрдЯ рдЦрд░реАрджрдирд╛ рд╣реИред"},
    {"word": "рдЯрдм", "emoji": "ЁЯЫБ", "audio": "audio/words/tub.mp3", "meaning": "Tub", "sentence": "рдмрдЪреНрдЪреЗ рдЯрдм рдореЗрдВ рдЦреЗрд▓ рд░рд╣реЗ рд╣реИрдВред"}
  ]
}
