{
  "id": "sha_letter_01",
  "language": "hindi",
  "char": "рд╢",
  "audio": "audio/letters/sha/рд╢.mp3",
  "stroke_anim": "animations/letters/sha/рд╢.json",
  "examples": [
    {"word": "рд╢рд╣рд░", "emoji": "ЁЯПЩя╕П", "audio": "audio/words/shahar.mp3", "meaning": "City", "sentence": "рд╣рдо рд╢рд╣рд░ рдореЗрдВ рд░рд╣рддреЗ рд╣реИрдВред"},
    {"word": "рд╢рдХреНрддрд┐", "emoji": "ЁЯТк", "audio": "audio/words/shakti.mp3", "meaning": "Power", "sentence": "рдЙрд╕рдореЗрдВ рдмрд╣реБрдд рд╢рдХреНрддрд┐ рд╣реИред"},
    {"word": "рд╢рд╛рдВрддрд┐", "emoji": "ЁЯХКя╕П", "audio": "audio/words/shanti.mp3", "meaning": "Peace", "sentence": "рд╣рдореЗрдВ рд╢рд╛рдВрддрд┐ рдЪрд╛рд╣рд┐рдПред"}
  ]
}
