{
  "id": "d_letter_01",
  "language": "hindi",
  "char": "рдж",
  "audio": "audio/letters/d/рдж.mp3",
  "stroke_anim": "animations/letters/d/рдж.json",
  "examples": [
    {"word": "рджрд░рд╡рд╛рдЬрд╝рд╛", "emoji": "ЁЯЪк", "audio": "audio/words/darwaza.mp3", "meaning": "Door", "sentence": "рдХреГрдкрдпрд╛ рджрд░рд╡рд╛рдЬрд╝рд╛ рдмрдВрдж рдХрд░реЛред"},
    {"word": "рджрдлреНрддрд░", "emoji": "ЁЯПв", "audio": "audio/words/daftar.mp3", "meaning": "Office", "sentence": "рд╡рд╣ рджрдлреНрддрд░ рдореЗрдВ рдХрд╛рдо рдХрд░рддрд╛ рд╣реИред"},
    {"word": "рджреВрдз", "emoji": "ЁЯеЫ", "audio": "audio/words/doodh.mp3", "meaning": "Milk", "sentence": "рдореБрдЭреЗ рдПрдХ рдЧрд┐рд▓рд╛рд╕ рджреВрдз рдЪрд╛рд╣рд┐рдПред"}
  ]
}
