{
  "id": "aa_letter_01",
  "language": "hindi",
  "char": "рдЖ",
  "audio": "audio/letters/a/рдЖ.mp3",
  "stroke_anim": "animations/letters/a/рдЖ.json",
  "examples": [
    {"word": "рдЖрдо", "emoji": "ЁЯен", "audio": "audio/words/aam.mp3", "meaning": "Mango", "sentence": "рдЖрдо рдореМрд╕рдо рдореЗрдВ рдорд┐рд▓рддрд╛ рд╣реИред"},
    {"word": "рдЖрдЯрд╛", "emoji": "ЁЯМ╛", "audio": "audio/words/aata.mp3", "meaning": "Flour", "sentence": "рд░реЛрдЯреА рдХреЗ рд▓рд┐рдП рдЖрдЯрд╛ рдЪрд╛рд╣рд┐рдПред"},
    {"word": "рдЖрдирдВрдж", "emoji": "ЁЯШК", "audio": "audio/words/anand.mp3", "meaning": "Joy", "sentence": "рдмрдЪреНрдЪреЛрдВ рдХреЛ рдЦреЗрд▓ рдореЗрдВ рдЖрдирдВрдж рдЖрддрд╛ рд╣реИред"}
  ]
}
