{
  "id": "g_letter_01",
  "language": "hindi",
  "char": "‡§ó",
  "audio": "audio/letters/g/‡§ó.mp3",
  "stroke_anim": "animations/letters/g/‡§ó.json",
  "examples": [
    {"word": "‡§ó‡•Å‡§¨‡•ç‡§¨‡§æ‡§∞‡§æ", "emoji": "üéà", "audio": "audio/words/gubbara.mp3", "meaning": "Balloon", "sentence": "‡§¨‡§ö‡•ç‡§ö‡•á ‡§ó‡•Å‡§¨‡•ç‡§¨‡§æ‡§∞‡•á ‡§â‡§°‡§º‡§æ ‡§∞‡§π‡•á ‡§π‡•à‡§Ç‡•§"},
    {"word": "‡§ó‡§æ‡§®‡§æ", "emoji": "üéµ", "audio": "audio/words/gana.mp3", "meaning": "Song", "sentence": "‡§µ‡§π ‡§Ö‡§ö‡•ç‡§õ‡§æ ‡§ó‡§æ‡§®‡§æ ‡§ó‡§æ‡§§‡•Ä ‡§π‡•à‡•§"},
    {"word": "‡§ó‡§≤‡•Ä", "emoji": "üõ£Ô∏è", "audio": "audio/words/gali.mp3", "meaning": "Street", "sentence": "‡§π‡§Æ ‡§ó‡§≤‡•Ä ‡§Æ‡•á‡§Ç ‡§ü‡§π‡§≤ ‡§∞‡§π‡•á ‡§•‡•á‡•§"}
  ]
}
