{
  "id": "ddh_letter_01",
  "language": "hindi",
  "char": "рдв",
  "audio": "audio/letters/ddh/рдв.mp3",
  "stroke_anim": "animations/letters/ddh/рдв.json",
  "examples": [
    {"word": "рдвреЛрд▓", "emoji": "ЁЯеБ", "audio": "audio/words/dhol.mp3", "meaning": "Drum", "sentence": "рдореЗрд▓реЗ рдореЗрдВ рдвреЛрд▓ рдмрд╛рдЬ рд░рд╣рд╛ рд╣реИред"},
    {"word": "рдврд╝рд╛рдИ", "emoji": "тЪЦя╕П", "audio": "audio/words/dhai.mp3", "meaning": "Two and a half", "sentence": "рд╕рдордп рдврд╛рдИ рдШрдВрдЯреЗ рдХрд╛ рд╣реИред"},
    {"word": "рдврдХреНрдХрди", "emoji": "ЁЯлЩ", "audio": "audio/words/dhakkan.mp3", "meaning": "Lid", "sentence": "рдмрд░реНрддрди рдХрд╛ рдврдХреНрдХрди рдмрдВрдж рд╣реИред"}
  ]
}
