{
  "id": "n_letter_01",
  "language": "hindi",
  "char": "рди",
  "audio": "audio/letters/n/рди.mp3",
  "stroke_anim": "animations/letters/n/рди.json",
  "examples": [
    {"word": "рдирджреА", "emoji": "ЁЯПЮя╕П", "audio": "audio/words/nadi.mp3", "meaning": "River", "sentence": "рдирджреА рдХрд┐рдирд╛рд░реЗ рдкреЗрдбрд╝ рд╣реИрдВред"},
    {"word": "рдирдордХ", "emoji": "ЁЯзВ", "audio": "audio/words/namak.mp3", "meaning": "Salt", "sentence": "рдЦрд╛рдиреЗ рдореЗрдВ рдирдордХ рдбрд╛рд▓реЗрдВред"},
    {"word": "рдирдпреА", "emoji": "ЁЯЖХ", "audio": "audio/words/nayi.mp3", "meaning": "New", "sentence": "рдпрд╣ рдХрд┐рддрд╛рдм рдирдпреА рд╣реИред"}
  ]
}
