{
  "id": "h_letter_01",
  "language": "hindi",
  "char": "рдЕ",
  "audio": "audio/letters/h/рдЕ.mp3",
  "stroke_anim": "animations/letters/h/рдЕ.json",
  "examples": [
    {"word": "рдЕрджрд░рдХ", "emoji": "ЁЯлЪ", "audio": "audio/words/adarak.mp3", "meaning": "Ginger", "sentence": "рдЕрджрд░рдХ рд╕реЗ рд╕реНрд╡рд╛рдж рдмрдврд╝рддрд╛ рд╣реИред"},
    {"word": "рдЖрдо", "emoji": "ЁЯНС", "audio": "audio/words/aam.mp3", "meaning": "Mango", "sentence": "рдЖрдо рдореАрдард╛ рд╣реЛрддрд╛ рд╣реИред"},
    {"word": "рдЕрдирд╛рд░", "emoji": "ЁЯНО", "audio": "audio/words/anar.mp3", "meaning": "Pomegranate", "sentence": "рдЕрдирд╛рд░ рд▓рд╛рд▓ рдФрд░ рд░рд╕реАрд▓рд╛ рд╣реЛрддрд╛ рд╣реИред"}
  ]
}
