{
  "id": "ra_letter_01",
  "language": "hindi",
  "char": "рд░",
  "audio": "audio/letters/ra/рд░.mp3",
  "stroke_anim": "animations/letters/ra/рд░.json",
  "examples": [
    {"word": "рд░реЛрдЬ", "emoji": "ЁЯУЕ", "audio": "audio/words/roj.mp3", "meaning": "Daily", "sentence": "рдореИрдВ рд░реЛрдЬ рд╕реНрдХреВрд▓ рдЬрд╛рддрд╛ рд╣реВрдБред"},
    {"word": "рд░рдВрдЧ", "emoji": "ЁЯОи", "audio": "audio/words/rang.mp3", "meaning": "Color", "sentence": "рдпрд╣ рд░рдВрдЧ рдмрд╣реБрдд рд╕реБрдВрджрд░ рд╣реИред"},
    {"word": "рд░рд╕", "emoji": "ЁЯзГ", "audio": "audio/words/ras.mp3", "meaning": "Juice/Flavor", "sentence": "рдлрд▓ рдХрд╛ рд░рд╕ рдореАрдард╛ рд╣реИред"}
  ]
}
