{
  "id": "nna_letter_01",
  "language": "hindi",
  "char": "рдг",
  "audio": "audio/letters/nna/рдг.mp3",
  "stroke_anim": "animations/letters/nna/рдг.json",
  "examples": [
    {"word": "рдгрдордХ", "emoji": "ЁЯзВ", "audio": "audio/words/namak.mp3", "meaning": "Salt", "sentence": "рдЦрд╛рдиреЗ рдореЗрдВ рдирдордХ рдбрд╛рд▓реЗрдВред"},
    {"word": "рдкрдХрд╡рд╛рди", "emoji": "ЁЯН▓", "audio": "audio/words/pakwan.mp3", "meaning": "Dish", "sentence": "рдорд╛рдБ рдиреЗ рд╕реНрд╡рд╛рджрд┐рд╖реНрдЯ рдкрдХрд╡рд╛рди рдмрдирд╛рдпрд╛ред"},
    {"word": "рд╢рд░рдг", "emoji": "ЁЯПХя╕П", "audio": "audio/words/sharan.mp3", "meaning": "Shelter", "sentence": "рд╕рднреА рдХреЛ рд╢рд░рдг рдорд┐рд▓реАред"}
  ]
}
