{
  "id": "gh_letter_01",
  "language": "hindi",
  "char": "рдШ",
  "audio": "audio/letters/gh/рдШ.mp3",
  "stroke_anim": "animations/letters/gh/рдШ.json",
  "examples": [
    {"word": "рдШрдбрд╝рд╛", "emoji": "ЁЯП║", "audio": "audio/words/ghada.mp3", "meaning": "Pitcher", "sentence": "рдШрдбрд╝рд╛ рдкрд╛рдиреА рд╕реЗ рднрд░рд╛ рд╣реИред"},
    {"word": "рдШреЛрдбрд╝рд╛", "emoji": "ЁЯРО", "audio": "audio/words/ghoda.mp3", "meaning": "Horse", "sentence": "рдШреЛрдбрд╝рд╛ рддреЗрдЬ рджреМрдбрд╝рддрд╛ рд╣реИред"},
    {"word": "рдШрдВрдЯреА", "emoji": "ЁЯФФ", "audio": "audio/words/ghanti.mp3", "meaning": "Bell", "sentence": "рд╕реНрдХреВрд▓ рдХреА рдШрдВрдЯреА рдмрдЬреАред"}
  ]
}
