{
  "id": "i_letter_01",
  "language": "hindi",
  "char": "рдЗ",
  "audio": "audio/letters/i/рдЗ.mp3",
  "stroke_anim": "animations/letters/i/рдЗ.json",
  "examples": [
    {"word": "рдЗрдорд▓реА", "emoji": "ЁЯМ┐", "audio": "audio/words/imli.mp3", "meaning": "Tamarind", "sentence": "рдЗрдорд▓реА рдЦрдЯреНрдЯреА рд╣реЛрддреА рд╣реИред"},
    {"word": "рдЗрдорд▓реА рдХрд╛ рдЪрдЯрдиреА", "emoji": "ЁЯНп", "audio": "audio/words/imlichutney.mp3", "meaning": "Tamarind chutney", "sentence": "рд╕рдореЛрд╕реЗ рдХреЗ рд╕рд╛рде рдЗрдорд▓реА рдХреА рдЪрдЯрдиреА рдкрд╕рдВрдж рд╣реИред"},
    {"word": "рдЗрдВрдЬреАрдирд┐рдпрд░", "emoji": "ЁЯС╖", "audio": "audio/words/engineer.mp3", "meaning": "Engineer", "sentence": "рд╡рд╣ рдПрдХ рдЕрдЪреНрдЫрд╛ рдЗрдВрдЬреАрдирд┐рдпрд░ рд╣реИред"}
  ]
}
