{
  "id": "k_letter_01",
  "language": "hindi",
  "char": "рдХ",
  "audio": "audio/letters/k/рдХ.mp3",
  "stroke_anim": "animations/letters/k/рдХ.json",
  "examples": [
    {"word": "рдХрдорд▓", "emoji": "ЁЯМ╕", "audio": "audio/words/kamal.mp3", "meaning": "Lotus", "sentence": "рдХрдорд▓ рддрд╛рд▓рд╛рдм рдореЗрдВ рдЦрд┐рд▓рддрд╛ рд╣реИред"},
    {"word": "рдХрд┐рддрд╛рдм", "emoji": "ЁЯУЪ", "audio": "audio/words/kitab.mp3", "meaning": "Book", "sentence": "рдореИрдВ рдХрд┐рддрд╛рдм рдкрдврд╝рддрд╛ рд╣реВрдБред"},
    {"word": "рдХрдмреВрддрд░", "emoji": "ЁЯХКя╕П", "audio": "audio/words/kabutar.mp3", "meaning": "Pigeon", "sentence": "рдХрдмреВрддрд░ рдЙрдбрд╝ рд░рд╣рд╛ рд╣реИред"}
  ]
}
