{
  "id": "l_letter_01",
  "language": "hindi",
  "char": "рд▓",
  "audio": "audio/letters/l/рд▓.mp3",
  "stroke_anim": "animations/letters/l/рд▓.json",
  "examples": [
    {"word": "рд▓рд╛рд▓", "emoji": "ЁЯФ┤", "audio": "audio/words/laal.mp3", "meaning": "Red", "sentence": "рдпрд╣ рд╕реЗрдм рд▓рд╛рд▓ рд╣реИред"},
    {"word": "рд▓рдбреНрдбреВ", "emoji": "ЁЯзБ", "audio": "audio/words/ladoo.mp3", "meaning": "Ladoo (sweet)", "sentence": "рдореЗрд░реА рджрд╛рджреА рд▓рдбреНрдбреВ рдмрдирд╛рддреА рд╣реИрдВред"},
    {"word": "рд▓рд╣рд░", "emoji": "ЁЯМК", "audio": "audio/words/lahar.mp3", "meaning": "Wave", "sentence": "рд╕рдореБрджреНрд░ рдХреА рд▓рд╣рд░реЗрдВ рдмрдбрд╝реА рд╣реИрдВред"}
  ]
}
