{
  "id": "ph_letter_01",
  "language": "hindi",
  "char": "рдл",
  "audio": "audio/letters/ph/рдл.mp3",
  "stroke_anim": "animations/letters/ph/рдл.json",
  "examples": [
    {"word": "рдлрд▓", "emoji": "ЁЯНО", "audio": "audio/words/phal.mp3", "meaning": "Fruit", "sentence": "рдлрд▓ рдЦрд╛рдирд╛ рд╕реЗрд╣рддрдордВрдж рд╣реИред"},
    {"word": "рдлреВрд▓", "emoji": "ЁЯМ╕", "audio": "audio/words/fool.mp3", "meaning": "Flower", "sentence": "рдмрдЧреАрдЪреЗ рдореЗрдВ рд╕реБрдВрджрд░ рдлреВрд▓ рд╣реИрдВред"},
    {"word": "рдлрд░рд┐рд╢реНрддрд╛", "emoji": "ЁЯС╝", "audio": "audio/words/farishta.mp3", "meaning": "Angel", "sentence": "рдХрд╣рд╛рдиреА рдореЗрдВ рдлрд░рд┐рд╢реНрддрд╛ рдЖрдпрд╛ред"}
  ]
}
