{
  "id": "uu_letter_01",
  "language": "hindi",
  "char": "рдК",
  "audio": "audio/letters/uu/рдК.mp3",
  "stroke_anim": "animations/letters/uu/рдК.json",
  "examples": [
    {"word": "рдКрдБрдЯ", "emoji": "ЁЯРк", "audio": "audio/words/oont.mp3", "meaning": "Camel", "sentence": "рд░реЗрдЧрд┐рд╕реНрддрд╛рди рдореЗрдВ рдКрдБрдЯ рдЪрд▓рддрд╛ рд╣реИред"},
    {"word": "рдКрд░реНрдЬрд╛", "emoji": "тЪб", "audio": "audio/words/urja.mp3", "meaning": "Energy", "sentence": "рд╡реНрдпрд╛рдпрд╛рдо рд╕реЗ рдКрд░реНрдЬрд╛ рдмрдврд╝рддреА рд╣реИред"},
    {"word": "рдКрдмрдирд╛", "emoji": "ЁЯШЮ", "audio": "audio/words/oobna.mp3", "meaning": "Get bored", "sentence": "рд▓рдВрдмреЗ рд╕рдордп рд╕реЗ рд╡рд╣ рдКрдм рд░рд╣рд╛ рдерд╛ред"}
  ]
}
