{
  "id": "b_letter_01",
  "language": "hindi",
  "char": "рдм",
  "audio": "audio/letters/b/рдм.mp3",
  "stroke_anim": "animations/letters/b/рдм.json",
  "examples": [
    {"word": "рдмрд┐рд▓реНрд▓реА", "emoji": "ЁЯР▒", "audio": "audio/words/billi.mp3", "meaning": "Cat", "sentence": "рдмрд┐рд▓реНрд▓реА рдореНрдпрд╛рдКрдБ рдХрд░рддреА рд╣реИред"},
    {"word": "рдмрд╕", "emoji": "ЁЯЪМ", "audio": "audio/words/bus.mp3", "meaning": "Bus", "sentence": "рд╣рдо рдмрд╕ рд╕реЗ рд╕реНрдХреВрд▓ рдЬрд╛рддреЗ рд╣реИрдВред"},
    {"word": "рдмрдХрд░реА", "emoji": "ЁЯРР", "audio": "audio/words/bakri.mp3", "meaning": "Goat", "sentence": "рдмрдХрд░реА рджреВрдз рджреЗрддреА рд╣реИред"}
  ]
}
